{
  "$schema": "http://json-schema.org/draft-07/schema#",
  "title": "ProcessKnowledgeDTO",
  "type": "object",
  "properties": {
    "activities": { "type": "array", "items": { "type": "string" } },
    "actors": { "type": "array", "items": { "type": "string" } },
    "systems": { "type": "array", "items": { "type": "string" } },
    "events": { "type": "array", "items": { "type": "string" } },
    "decisions": { "type": "array", "items": { "type": "string" } }
  },
  "required": ["activities", "actors", "systems", "events", "decisions"],
  "additionalProperties": false
}